{
  "verdict": "APPROVE",
  "project": "polytopia-clone",
  "timestamp": "2026-06-26T22:35:00Z",
  "cycle_id": "cron-20260626-2235",
  "reference_match": "minor_gaps",
  "checkpoint": {
    "current_task": "fix-ai-opponent-intelligence",
    "commit_sha": "98eba7b",
    "last_coach_review": "2026-06-26T22:10:00Z"
  },
  "methodology": {
    "total_failures": 0,
    "test_bugs": 0,
    "methodology_failures": 0,
    "systemic": false,
    "can_approve": true
  },
  "findings": [
    {
      "severity": "P2",
      "type": "other",
      "area": "ai",
      "description": "AI territory expansion spec_gap stagnant for 9 cycles (escalated). AI still uses basic wander-to-unseen behavior, does not prioritize high-value resource tiles or strategic chokepoints. Not a regression from this commit — the Player addressed difficulty differentiation (item 5) but territory expansion (item 3 of fix-ai-opponent-intelligence) remains unaddressed.",
      "evidence": "Checkpoint .checkpoint.json spec_gaps: 'AI territory expansion still basic — no strategic resource claiming', cycles_stagnant=9, status='escalated'",
      "test_attribution": "checkpoint audit"
    }
  ],
  "tasks_generated": [],
  "errors": []
}
